<?xml version="1.0" encoding="UTF-8"?>
<!DOCTYPE variables SYSTEM "felt_variables.dtd">
<variables>
<parameter id="101,2,1000" name="altitude">
	<attribute name="long_name" value="altitude" type="string" />
	<attribute name="standard_name" value="altitude" type="string" />
	<attribute name="units" value="m" type="string" />
</parameter>
<parameter id="103,2,1000" name="sea_surface_temperature">
	<attribute name="long_name" value="sea_surface_temperature" type="string" />
	<attribute name="standard_name" value="sea_surface_temperature" type="string" />
	<attribute name="scale_factor" value="100" type="float" />
	<attribute name="units" value="K" type="string" />
</parameter>
<parameter id="181,2,1000" name="land_area_fraction">
	<attribute name="long_name" value="land_area_fraction" type="string" />
	<attribute name="metno_name" value="land_area_fraction" type="string" />
	<attribute name="units" value="1" type="string" />
</parameter>
<parameter id="182,2,1000" name="surface_roughness_length">
	<attribute name="long_name" value="surface_roughness_length" type="string" />
	<attribute name="standard_name" value="surface_roughness_length" type="string" />
	<attribute name="metno_info" value="climatology" type="string" />
	<attribute name="units" value="m" type="string" />
</parameter>
<parameter id="183,2,1000" name="soil_temperature" type="short">
	<attribute name="_FillValue" value="-32767" type="short" />
	<attribute name="long_name" value="soil_temperature" type="string" />
	<attribute name="standard_name" value="soil_temperature" type="string" />
	<attribute name="metno_info" value="climatology_deep_soil_temperature" type="string" />
	<attribute name="scale_factor" value="100" type="float" />
	<attribute name="units" value="K" type="string" />
</parameter>
<parameter id="186,2,1000" name="moisture_content_of_soil_layer" type="short">
	<attribute name="_FillValue" value="-32767" type="short" />
	<attribute name="long_name" value="moisture_content_of_soil_layer" type="string" />
	<attribute name="standard_name" value="moisture_content_of_soil_layer" type="string" />
	<attribute name="metno_info" value="climatology_moisture_content_of_deep_soil_layer" type="string" />
	<attribute name="units" value="kg m-2" type="string" />
</parameter>
<parameter id="191,2,1000" name="sea_ice_area_fraction">
	<attribute name="long_name" value="sea_ice_area_fraction" type="string" />
	<attribute name="standard_name" value="sea_ice_area_fraction" type="string" />
	<attribute name="units" value="1" type="string" />
</parameter>

</variables>
