<?xml version="1.0" encoding="UTF-8"?>
<!DOCTYPE variables SYSTEM "felt_variables.dtd">
<variables>
<!--  I dont use components in model-layer 59/60 (see hirlam12ml) -->
<parameter id="17,2,1000" name="precipitation_amount" type="float">
	<attribute name="_FillValue" value="9.9692099683868690e+36f" type="float" />
	<attribute name="long_name" value="precipitation_amount" type="string" />
	<attribute name="standard_name" value="precipitation_amount" type="string" />
	<attribute name="units" value="kg/m2" type="string" />
</parameter>
<parameter id="25,2,1000" name="cloud_area_fraction">
	<attribute name="scale_factor" value="0.01" type="float" />
	<attribute name="_FillValue" value="-32767" type="short" />
	<attribute name="cell_methods" value="time: point" type="string" />
	<attribute name="long_name" value="cloud_area_fraction" type="string" />
	<attribute name="standard_name" value="cloud_area_fraction" type="string" />
	<attribute name="units" value="1" type="string" />
</parameter>
<parameter id="31,2,1000" name="air_temperature" type="float">
	<attribute name="_FillValue" value="9.9692099683868690e+36f" type="float" />
	<attribute name="cell_methods" value="time: point height: 2m" type="string" />
	<attribute name="long_name" value="air_temperature_2m" type="string" />
	<attribute name="standard_name" value="air_temperature" type="string" />
	<attribute name="units" value="K" type="string" />
</parameter>
<parameter id="32,2,1000" name="relative_humidity">
	<attribute name="_FillValue" value="-32767" type="short" />
	<attribute name="scale_factor" value="0.01" type="float" />
	<attribute name="cell_methods" value="time: point height: 2m" type="string" />
	<attribute name="long_name" value="relative_humidity" type="string" />
	<attribute name="standard_name" value="relative_humidity" type="string" />
	<attribute name="units" value="1" type="string" />
</parameter>
<!--  currently not distributing vector data due to missing support in fimex
<parameter id="33,2,1000" name="x_wind">
	<attribute name="_FillValue" value="-32767" type="short" />
	<attribute name="cell_methods" value="time: point height: 10m" type="string" />
	<attribute name="long_name" value="x_wind" type="string" />
	<attribute name="standard_name" value="x_wind" type="string" />
	<attribute name="height" value="10m" type="string" />
	<attribute name="units" value="m s-1" type="string" />
</parameter>
<parameter id="34,2,1000" name="y_wind">
	<attribute name="_FillValue" value="-32767" type="short" />
	<attribute name="cell_methods" value="time: point height: 10m" type="string" />
	<attribute name="long_name" value="y_wind" type="string" />
	<attribute name="standard_name" value="y_wind" type="string" />
	<attribute name="height" value="10m" type="string" />
	<attribute name="units" value="m s-1" type="string" />
</parameter>
-->
<parameter id="39" name="cloud_area_fraction_in_atmosphere_layer">
	<attribute name="long_name" value="cloud_area_fraction_in_atmosphere_layer" type="string" />
	<attribute name="standard_name" value="cloud_area_fraction_in_atmosphere_layer" type="string" />
	<attribute name="scale_factor" value="0.01" type="float" />
	<attribute name="units" value="1" type="string" />
</parameter>
<parameter id="58,2,1000" name="sea_level_pressure">
	<attribute name="scale_factor" value="100." type="float" />
	<attribute name="_FillValue" value="-32767" type="short" />
	<attribute name="cell_methods" value="time: point" type="string" />
	<attribute name="long_name" value="air_pressure_at_sea_level" type="string" />
	<attribute name="standard_name" value="air_pressure_at_sea_level" type="string" />
	<attribute name="units" value="Pa" type="string" />
</parameter>
<parameter id="131,2,1000" name="surface_temperature_where_land">
	<attribute name="long_name" value="surface_temperature_where_land" type="string" />
	<attribute name="standard_name" value="surface_temperature_2m_where_land" type="string" />
	<attribute name="metno_info" value="height: 2m" type="string"/>
	<attribute name="units" value="K" type="string" />
</parameter>
</variables>
