<?xml version="1.0" encoding="UTF-8"?>
<!DOCTYPE variables SYSTEM "felt_variables.dtd">
<variables>
<parameter id="1" name="geopotential_height" type="float">
	<attribute name="_FillValue" value="9.9692099683868690e+36" type="float" />
	<attribute name="long_name" value="geopotential_height" type="string" />
	<attribute name="standard_name" value="geopotential_height" type="string" />
	<attribute name="units" value="m" type="string" />
</parameter>
<parameter id="2" name="x_wind" type="float">
	<attribute name="_FillValue" value="9.9692099683868690e+36" type="float" />
	<attribute name="long_name" value="x_wind" type="string" />
	<attribute name="standard_name" value="x_wind" type="string" />
	<attribute name="units" value="m/s" type="string" />
	<spatial_vector direction="x,longitude" counterpart="y_wind" />
</parameter>
<parameter id="3" name="y_wind" type="float">
	<attribute name="_FillValue" value="9.9692099683868690e+36" type="float" />
	<attribute name="long_name" value="y_wind" type="string" />
	<attribute name="standard_name" value="y_wind" type="string" />
	<attribute name="units" value="m/s" type="string" />
	<spatial_vector direction="y,latitude" counterpart="x_wind" />
</parameter>
<parameter id="10" name="relative_humidity" type="float">
	<attribute name="_FillValue" value="9.9692099683868690e+36" type="float" />
	<attribute name="scale_factor" value="0.01" type="float" />
	<attribute name="long_name" value="relative_humidity" type="string" />
	<attribute name="standard_name" value="relative_humidity" type="string" />
	<attribute name="units" value="1" type="string" />
</parameter>
<parameter id="13" name="omega" type="float">
	<attribute name="_FillValue" value="9.9692099683868690e+36" type="float" />
	<attribute name="long_name" value="lagrangian_tendency_of_air_pressure" type="string" />
	<attribute name="standard_name_alias" value="vertical_air_velocity_expressed_as_tendency_of_pressure" type="string" />	
	<attribute name="standard_name" value="lagrangian_tendency_of_air_pressure" type="string" />
	<attribute name="units" value="1000 hPa/s" type="string" />
</parameter>
<parameter id="18" name="air_potential_temperature" type="float">
	<attribute name="_FillValue" value="9.9692099683868690e+36" type="float" />
	<attribute name="long_name" value="air_potential_temperature" type="string" />
	<attribute name="standard_name" value="air_potential_temperature" type="string" />
	<attribute name="units" value="K" type="string" />
</parameter>
</variables>
